{
  "name": "grc-engineering-suite",
  "owner": {
    "name": "GRC Engineering Club",
    "url": "https://grcengclub.com"
  },
  "metadata": {
    "description": "GRC Engineering Plugin Suite - Tools for auditors, internal teams, TPRM, and framework-specific compliance",
    "version": "0.1.0",
    "pluginRoot": "./plugins"
  },
  "plugins": [
    {
      "name": "grc-engineer",
      "source": "./plugins/grc-engineer",
      "description": "Maps IaC to compliance controls, generates policies, collects evidence, reviews PRs",
      "version": "0.1.0"
    },
    {
      "name": "grc-auditor",
      "source": "./plugins/grc-auditor",
      "description": "Evidence review, control validation, and audit workpaper generation for external auditors",
      "version": "0.1.0"
    },
    {
      "name": "grc-internal",
      "source": "./plugins/grc-internal",
      "description": "Policy management, risk registers, and compliance tracking for internal GRC teams",
      "version": "0.1.0"
    },
    {
      "name": "grc-tprm",
      "source": "./plugins/grc-tprm",
      "description": "Vendor assessments, questionnaire analysis, and risk scoring for third-party risk management",
      "version": "0.1.0"
    },
    {
      "name": "grc-reporter",
      "source": "./plugins/grc-reporter",
      "description": "Translate findings, risks, and metrics into narratives leadership reads. Reference implementation of the Reporting category from RFC #38.",
      "version": "0.1.0"
    },
    {
      "name": "grc-loop",
      "source": "./plugins/grc-loop",
      "description": "Iterative GRC automation loops for gap-remediation burndown and quarterly evidence sweeps.",
      "version": "0.1.0"
    },
    {
      "name": "gcp-docs",
      "source": "./plugins/knowledge-sources/gcp-docs",
      "description": "Knowledge source for Google Developer Knowledge API: current Google developer documentation citations for GRC workflows.",
      "version": "0.1.0"
    },
    {
      "name": "teach-me",
      "source": "./plugins/teach-me",
      "description": "Socratic primer + drill plugin for new-to-GRC practitioners. Get up to speed on a framework, control, or role without already knowing it.",
      "version": "0.1.0"
    },
    {
      "name": "academic-research-companion",
      "source": "./plugins/academic-research-companion",
      "description": "Guide a research project through the academic lifecycle — idea, literature, methodology, writing, feedback, publishing, and authorship — with verified sources and a durable tracker.",
      "version": "0.1.0"
    },
    {
      "name": "grc-diagrams",
      "source": "./plugins/grc-diagrams",
      "description": "Editable draw.io diagram patterns for GRC system boundaries, evidence flows, control maps, risk treatment, audits, crosswalks, TPRM, POA&M, data flows, RACI, and operating models.",
      "version": "0.1.0",
      "category": "workflow",
      "tags": [
        "drawio",
        "diagrams",
        "grc",
        "audit",
        "risk",
        "compliance"
      ]
    },
    {
      "name": "soc2",
      "source": "./plugins/frameworks/soc2",
      "description": "SOC 2 Trust Service Criteria expertise and Type I/II assessment support",
      "version": "0.1.0"
    },
    {
      "name": "nist-800-53",
      "source": "./plugins/frameworks/nist-800-53",
      "description": "NIST 800-53 control families and baseline selection (Low/Moderate/High)",
      "version": "0.1.0"
    },
    {
      "name": "iso27001",
      "source": "./plugins/frameworks/iso27001",
      "description": "ISO 27001 Annex A controls and ISMS implementation guidance",
      "version": "0.1.0"
    },
    {
      "name": "fedramp-rev5",
      "source": "./plugins/frameworks/fedramp-rev5",
      "description": "FedRAMP Rev 5 traditional authorization with SSP/SAP/SAR/POA&M and NIST 800-53 controls",
      "version": "0.1.0"
    },
    {
      "name": "fedramp-20x",
      "source": "./plugins/frameworks/fedramp-20x",
      "description": "FedRAMP 20X automated authorization with KSIs, continuous monitoring, and auto-sync from official docs",
      "version": "0.1.0"
    },
    {
      "name": "pci-dss",
      "source": "./plugins/frameworks/pci-dss",
      "description": "PCI DSS v4.0.1 compliance with ROC guidance, SAQ selection, and March 2025 requirements",
      "version": "0.1.0"
    },
    {
      "name": "cmmc",
      "source": "./plugins/frameworks/cmmc",
      "description": "CMMC v2.0 (DoD contractors) with 5 levels and C3PAO assessment prep",
      "version": "0.1.0"
    },
    {
      "name": "hitrust",
      "source": "./plugins/frameworks/hitrust",
      "description": "HITRUST CSF healthcare security with i1/r2 assessments",
      "version": "0.1.0"
    },
    {
      "name": "cis-controls",
      "source": "./plugins/frameworks/cis-controls",
      "description": "CIS Controls v8 baseline security with IG1/IG2/IG3 levels",
      "version": "0.1.0"
    },
    {
      "name": "gdpr",
      "source": "./plugins/frameworks/gdpr",
      "description": "GDPR EU privacy regulation with DPIA and data subject rights",
      "version": "0.1.0"
    },
    {
      "name": "csa-ccm",
      "source": "./plugins/frameworks/csa-ccm",
      "description": "CSA Cloud Controls Matrix with 197 controls and CAIQ support",
      "version": "0.1.0"
    },
    {
      "name": "nydfs",
      "source": "./plugins/frameworks/nydfs",
      "description": "NYDFS 23 NYCRR 500 cybersecurity requirements for financial services",
      "version": "0.1.0"
    },
    {
      "name": "dora",
      "source": "./plugins/frameworks/dora",
      "description": "DORA EU Digital Operational Resilience Act for financial entities",
      "version": "0.1.0"
    },
    {
      "name": "stateramp",
      "source": "./plugins/frameworks/stateramp",
      "description": "StateRAMP state/local government cloud authorization",
      "version": "0.1.0"
    },
    {
      "name": "essential8",
      "source": "./plugins/frameworks/essential8",
      "description": "Essential 8 Australian cyber security strategies with maturity levels",
      "version": "0.1.0"
    },
    {
      "name": "glba",
      "source": "./plugins/frameworks/glba",
      "description": "GLBA Gramm-Leach-Bliley Act for financial institution privacy",
      "version": "0.1.0"
    },
    {
      "name": "us-export",
      "source": "./plugins/frameworks/us-export",
      "description": "US Export Controls: ITAR (defense) + EAR (dual-use commercial) compliance",
      "version": "0.1.0"
    },
    {
      "name": "us-hipaa-security",
      "source": "./plugins/frameworks/us-hipaa-security",
      "description": "HIPAA Security Rule (45 CFR Part 164, Subpart C) for ePHI protection with Administrative, Physical, and Technical Safeguards",
      "version": "0.1.0"
    },
    {
      "name": "pbmm",
      "source": "./plugins/frameworks/pbmm",
      "description": "Canadian PBMM (Protected B Medium Medium) with ITSG-33 controls",
      "version": "0.1.0"
    },
    {
      "name": "ismap",
      "source": "./plugins/frameworks/ismap",
      "description": "Japanese ISMAP government cloud security (ISO 27001/27017/27018)",
      "version": "0.1.0"
    },
    {
      "name": "irap",
      "source": "./plugins/frameworks/irap",
      "description": "Australian IRAP (ISM + Essential Eight) for government cloud",
      "version": "0.1.0"
    },
    {
      "name": "aws-inspector",
      "source": "./plugins/connectors/aws-inspector",
      "description": "GRC connector for AWS: IAM, S3, CloudTrail, EBS compliance checks \u2192 v1 finding contract",
      "version": "0.1.0"
    },
    {
      "name": "github-inspector",
      "source": "./plugins/connectors/github-inspector",
      "description": "GRC connector for GitHub: branch protection, secret scanning, Dependabot, code scanning \u2192 v1 finding contract",
      "version": "0.1.0"
    },
    {
      "name": "gcp-inspector",
      "source": "./plugins/connectors/gcp-inspector",
      "description": "GRC connector for Google Cloud: IAM, Cloud Storage, audit logs, KMS rotation, Compute OS Login \u2192 v1 finding contract",
      "version": "0.1.0"
    },
    {
      "name": "azure-inspector",
      "source": "./plugins/connectors/azure-inspector",
      "description": "GRC connector for Azure: Entra ID, Storage, Key Vault, Monitor, and Defender for Cloud to v1 finding contract",
      "version": "0.1.0"
    },
    {
      "name": "slack-inspector",
      "source": "./plugins/connectors/slack-inspector",
      "description": "GRC connector for Slack: workspace 2FA, SSO/session, retention, app approvals, and DLP visibility to v1 finding contract",
      "version": "0.1.0"
    },
    {
      "name": "datadog-inspector",
      "source": "./plugins/connectors/datadog-inspector",
      "description": "GRC connector for Datadog: log retention, audit logs, monitor coverage, SSO, and RBAC to v1 finding contract",
      "version": "0.1.0"
    },
    {
      "name": "crowdstrike-inspector",
      "source": "./plugins/connectors/crowdstrike-inspector",
      "description": "GRC connector for CrowdStrike Falcon: sensor coverage, policies, and host-group scoping to v1 finding contract",
      "version": "0.1.0"
    },
    {
      "name": "drata-inspector",
      "source": "./plugins/connectors/drata-inspector",
      "description": "GRC connector for Drata: wraps drata-cli workflows and normalizes compliance posture to v1 finding contract",
      "version": "0.1.0"
    },
    {
      "name": "splunk-inspector",
      "source": "./plugins/connectors/splunk-inspector",
      "description": "GRC connector for Splunk: index retention, RBAC, audit coverage, search ACLs, and auth posture to v1 finding contract",
      "version": "0.1.0"
    },
    {
      "name": "tenable-inspector",
      "source": "./plugins/connectors/tenable-inspector",